<?xml version="1.0" encoding="utf-8"?>
<!--
Nombre: Cristian Mateos
Descripción: Información de un mail
Fecha:25-11-2024
-->
<mail xmlns:xsi="http://www.w3.org/2001/XMLSchema-instance" xsi:noNamespaceSchemaLocation="01.xsd">
    <remitente>remitente@example.com</remitente>
    <destinatarios>
        <destinatario>destinatario1@example.com</destinatario>
        <destinatario>destinatario2@example.com</destinatario>
    </destinatarios>
    <fecha>
        <dia>12</dia>
        <mes>03</mes>
        <anio>2025</anio>
    </fecha>
    <asunto>Ejemplo de correo en XML</asunto>
    <mensaje>
        <h2>Encabezado del mensaje</h2>
        <p>Este es un <strong>ejemplo</strong> de mensaje en XML.</p>
        <ul>
            <li>Punto 1</li>
            <li>Punto 2</li>
        </ul>
    </mensaje>
    <ficheros_adjuntos>
        <fichero>
            <nombre>documento.pdf</nombre>
            <tipo>application/pdf</tipo>
        </fichero>
        <fichero>
            <nombre>imagen.jpg</nombre>
            <tipo>image/jpeg</tipo>
        </fichero>
    </ficheros_adjuntos>
</mail>
